speaker,university,Panel,Specific Field,talkTitle,talkDescription,speakerBio
Anshul Kundaje,,,,Deep learning the regulatory code of the human genome,"The human genome contains the fundamental code that defines the identity and function of all the cell types and tissues in the human body. Genes are functional sequence units that encode for proteins. But they account for just about 2% of the 3 billion long human genome sequence. What does the rest of the genome encode? How is gene activity controlled in each cell type? Where do the regulatory control elements lie and what is their sequence composition? How do variants and mutations in the genome sequence affect cellular function and disease? These are fundamental questions that remain largely unanswered. The regulatory code that controls gene activity consists of DNA words with complex syntax and grammar (akin to natural language) encoded within hierarchically organized units of regulatory elements. These syntactic units of functional DNA words are sparsely distributed across billions of nucleotides of genomic sequence and remain largely elusive. Deep learning has revolutionized natural language, speech and vision applications. I will show that deep learning also has the potential to revolutionize our understanding of the regulatory language of the genome. We have developed integrative supervised deep learning frameworks to learn how genomic sequence encodes millions of experimentally measured regulatory genomic events across 100s of cell types and tissues. We have developed novel methods to interpret our models and extract local and global predictive patterns revealing many insights into the regulatory code. We will demonstrate how we can use deep learning models as oracles and perform millions of in-silico experiments to reveal the regulatory code. Our models also allow us to predict the effects of natural and disease-associated genetic variation i.e. how differences in DNA sequence across healthy and diseased individuals are likely to affect molecular mechanisms associated with complex traits and diseases.","Anshul Kundaje is an Assistant Professor of Genetics and Computer Science at Stanford University. The Kundaje lab develops statistical and machine learning methods for large-scale integrative analysis of functional genomic data to decode regulatory elements and pathways across diverse cell types and tissues and understand their role in cellular function and disease. Anshul completed his Ph.D. in Computer Science in 2008 from Columbia University. As a postdoc at Stanford University from 2008-2012 and a research scientist at MIT and the Broad Institute from 2012-2014, he led the integrative analysis efforts for two of the largest functional genomics consortia - The Encyclopedia of DNA Elements (ENCODE) and The Roadmap Epigenomics Project. Dr. Kundaje is a recipient of the 2019 Chen Award of Excellence from the Human Genome Organization, 2016 NIH Director’s New Innovator Award and The 2014 Alfred Sloan Foundation Fellowship. Anshul is also a member of the NIH Director's Advisory Committee for Artificial Intelligence in Biomedical Research."
James Robert Swartz,Stanford,Biology,Biotechnology,Microbial Protein Expression and Metabolism,"The current and projected research in the Swartz lab balances basic research in microbial metabolism, protein expression, and protein folding with a strong emphasis on compelling applications. The power and versatility of cell-free methods coupled with careful evaluation and engineering of these new systems enables a whole new range of applications and scientific investigation. Fundamental research on: the mechanisms and kinetics of ribosomal function, fundamental bioenergetics, basic mechanisms of protein folding, functional genomics, and metabolic pathway analysis is motivated by a variety of near- and medium term applications spanning medicine, energy, and environmental needs.",
Lorie Loeb,Dartmouth,CS,,,,
Dr. My T. Le ,Stanford,,,"Finding Your North Star
My journey from a refugee camp to the heart of Silicon Valley.","My T. Le is a technologist, entrepreneur, and educator. She received her Ph.D. in Electrical Engineering and Computer Sciences from University of California, Berkeley. She works, advises and invests in start-ups. She co-teaches EE15 - a popular Freshman Seminar and teaches EE46 - Engineering for Good - at Stanford University. In her spare time, she can be found telling bad jokes to her daughters and being a member of Dub Nation.",
Akshaya Annapragada,John Hopkins,,,Putting the M in STEM: Math AND Medicine,"How can students in math and engineering apply their skills to tackle tough problems in health and medicine? In this talk, I will discuss my experiences as a college student and MD/PhD student studying applied math and bioengineering. I’ll present examples from my own research of ways in which I’ve used mathematical modeling to design vaccination interventions and streamline medical diagnoses, and share my thoughts on how students can work at the intersection of math, engineering and medicine to enable social impact. ",
Dr. Jens Koch, sdsdf, CS,Systems and Networking,Probabilistic Combinatorics, "Quantum computing" is a hot buzzword right now. Quantum computers are supposed to be great and expected to vastly outperform today's best supercomputers. But what are they really and why is it taking us so long to make one? What does it take to be a physicist? What does the daily life of a quantum physicist look like? What is it like to study physics and where do you go from there?,"t."
Allison Jia, sdsdf, CS,Systems and Networking,Probabilistic Combinatorics,"Allison Jia is a student researcher, aspiring biomedical engineer, and recently graduated senior from The Harker School in San Jose, California. In 2019, Allison received the Intel Foundation Young Scientist Award at the International Science and Engineering Fair for her work in creating a live-imaging platform to visualize the neurodegeneration process responsible for diseases like Alzheimer's. Throughout high school, Allison served as the President of the Bay Area Society for Neuroscience and the Vice President of her school's research club. She is an avid supporter of STEM education and especially women in STEM. Allison is looking forward to continuing her studies at Stanford University in the fall.","t."
Dr. Corina Constantinescu, sdsdf, CS,Systems and Networking,Probabilistic Combinatorics,"We will be taking a journey through some recent topics in actuarial mathematics, all trying to address societal questions: how one should price women drivers in Saudi Arabia, how prevalent is the broken-heart syndrome in African countries and what is the effect of earthquakes on the mortgage market in Japan.", "." 
High School Level Biology Competition, ., ., ., ., The Biology High School Competition will focus on topics covered in AP Biology and USA Biology Olympiad — specifically the components and cellular processes in cells; the molecular and chromosomal basis of inheritance; gene expression; viruses and bacteria; and Darwinian mechanisms of evolution. The more difficult questions will be comparative to those on the USA Biology Olympiad while the easier level questions will be similar to AP Biology test questions., .
High School Level Math Competition, sdsdf, CS,Systems and Networking,Probabilistic Combinatorics,"The Competition Math High School Competition will test mathematical problem solving with arithmetic, algebra, counting, geometry, number theory, and probability, and other high school math topics. The more difficult questions will be comparative to those on the AMC 10/12 Competitions.", "." 
High School Level Physics Competition, sdsdf, CS,Systems and Networking,Probabilistic Combinatorics,"The Physics High School Competition will focus on topics covered in AP Physics 1 and the F=ma, specifically kinematics, dynamics, energy, momentum, gravity, oscillations, uncertainties, and dimensional analysis. A few questions will require the use of a calculator and an equation sheet will be provided. The difficulty of problems will range from easy Physics 1 problems to more challenging and conceptual F=ma exam questions.", "." 
High School Level Chemistry Competition, sdsdf, CS,Systems and Networking,Probabilistic Combinatorics,"The Chemistry High School Competition will focus on topics covered in AP Chemistry and the USA Chemistry Olympiad, specifically periodic trends, stoichiometry, acids and bases, ideal gas law, and chemical equilibrium. The questions will come in a range of difficulty and a few will require a calculator (periodic table and equation sheet will be provided). ", "." 
Vasile Patrascu, sdsdf, CS,Systems and Networking,Probabilistic Combinatorics,"A 'hands-on'principal software engineer with a 'can do' attitude that delivers high-quality projects on time. My objective is to have significant impact in a role that leverages my extensive experience in product definition, architecture, design and development.", "." 
Computer Science's Role in Bee Research, sdsdf, CS,Systems and Networking,Probabilistic Combinatorics,"Bees are important pollinators that support our agricultural and natural ecosystems. Beekeepers rely on honey bees for pollination services and products of the hive. There are over 20,000 species of bees worldwide and most bee species do not live in hives, make honey or sting to defend their nest. Unfortunately, some species of bees are declining due to habitat loss, parasites, pathogens and other challenges to their survival. Computer science has provided bee research with a variety of tools to help bee conservation. I will share background information about bees and spotlight conservation projects that are utilizing computer science to support research in a variety of ways from bee identification to hive health monitoring programs. ", "." 
Biochemistry Demonstration,sdf,CS,S,P,"In the frame of a home experiment we will discuss the relationship between form, function and protein structure.",