speaker,university,Panel,Specific Field,talkTitle,talkDescription,speakerBio
Richard Henry,John Hopkins University,Physics,Astronomy & Applied Physics,Physics is Simple! ,"Dick Henry is an astronomer, who has fallen in love with physics, and who loves to talk about the nature of physics! Dick always thought physics was very difficult; indeed incomprehensible; until he finally saw through it! He will tell you how to get there fast! The essential discovery was made thousands of years ago by Pythagoras in Greece, and even earlier by others in India and China. The universe is mathematical in its very bones. And high-school mathematics is all that you need to grasp that. ","Richard Conn Henry was born in Toronto, Canada, in 1940 and won the Gold Medal of the Royal Astronomical Society of Canada, while attaining his BA at the University of Toronto in 1962; in 1967 he received his PhD in Astronomy from Princeton and then he spent two years doing space research at the US Naval Research Laboratory before becoming an Assistant Professor of Physics at the Johns Hopkins University. After his first year at Hopkins, he took a year off to see the world, hitch-hiking across the Sahara desert, climbing Kimimanjaro, and going down the Nile on a barge; on to India, and the south Pacific. Back at Hopkins for Apollo 17 – dinner in the famous control room at Houston, while the astronauts, on the way home from the moon, observed his targets with the Hopkins ultraviolet spectrometer. Then Deputy Director of NASA’s Astrophysics Division for two years, successfully selling the Hubble Space Telescope to President Jimmy Carter. His research centers on cosmic diffuse ultraviolet background radiation from the universe. "
Xia Yang,UCLA,Biology,Integrative Biology and Bioinformatics,Dissecting Complex Human Diseases via Big Data Bioinformatics and Systems Biology,"Complex human diseases such as heart disease, diabetes, and Alzheimer’s disease involve complex cross-talks of many organs, tissues, cells, and biomolecules that are challenging to dissect. Thanks to recent technological advances that have enabled an outpour of biomedical big data, we are now positioned to piece together the puzzles of complex diseases. Our research aims to develop and utilize powerful bioinformatics and systems biology approaches to harmonize and integrate biomedical big data from human and model systems to dissect the molecular networks of complex human diseases. In this talk, I will introduce i) the importance and development of bioinformatics tools to accommodate diverse data types (genetic, epigenomic, transcriptomic, proteomic, etc) for network modeling of disease systems, and ii) the application of big data systems biology approaches in understanding cardiometabolic and brain disorders. These efforts have led to the elucidation of systems-level tissue-specific and cell-specific networks and critical regulators either specific to individual diseases or shared between diseases. The systems and network level insights will help guide the development of network-based medicine for common complex human diseases.","Xia Yang, Ph.D., (https://yanglab.ibp.ucla.edu) is currently a tenured Professor in the Department of Integrative Biology and Physiology and a faculty member of the Institute for Quantitative and Computational Biosciences at UCLA. Her lab focuses on developing and applying multi-tissue multi-omics systems biology approaches to understand the gene networks perturbed by genetic and environmental risks of complex human diseases, ranging from cardiometabolic diseases to neurodegenerative and neurological disorders. She received her PhD in Molecular Genetics with an emphasis on Bioinformatics from Georgia State University and obtained postdoctoral training in Systems Genetics at UCLA under the guidance of Dr. A. Jake Lusis. She subsequently worked as Senior Scientist at Rosetta Inpharmatics/Merck & Co. and Director of Systems Biology at Sage Bionetworks before returning to UCLA as a faculty member."
Jamie Spangler,John Hopkins University,Chemistry,Biomedical Engineering,Engineering proteins to reprogram the immune response,"Nature offers us a finite pool of proteins, and many of these molecules trigger
multiple contradictory effects, which limits their performance as potential drugs. Our lab
combines cutting-edge tools from biochemistry and engineering to redesign existing proteins or
create entirely new proteins to address the deficiencies of molecules found in nature. In
particular, we focus on engineering proteins that regulate the immune system to develop targeted
therapeutics to treat diseases including cancer, HIV, and diabetes.","Dr. Jamie Spangler earned a Bachelor of Science degree in Biomedical Engineering at Johns Hopkins University and went on to conduct her Ph.D. research in Biological Engineering in Professor K. Dane Wittrup’s group at MIT, studying antibody-mediated down-regulation of epidermal growth factor receptor as a new mechanism for cancer therapy. She then completed a postdoctoral fellowship in Professor K. Christopher Garcia’s lab in the Molecular & Cellular Physiology and Structural Biology departments at Stanford University School of Medicine, focusing on engineering cytokine systems to bias immune homeostasis. Dr. Spangler launched her independent research group at Johns Hopkins University in July 2017, jointly between the departments of Biomedical Engineering and Chemical & Biomolecular Engineering. Her lab, located in the Translational Tissue Engineering Center at the School of Medicine, applies structural and mechanistic insights to re-engineer existing proteins and design new proteins that therapeutically modulate the immune response. In particular, her group is interested in engineering immune molecules such as cytokines, growth factors, and antibodies for targeted treatment of diseases such as cancer and autoimmune disorders."
Isaac Cervantes Sandoval,Georgetown,Biology,Neurobiology?,Where did I leave my keys: Why do we forget?,"Have you ever wondered, ""why do we forget?"" Can you imagine a life where you could remember everything? Although this sounds interesting, it might not be a good idea, after all. Scientists have started to learn that forgetting is very important for the normal functioning of the brain. In this talk, we will cover the science behind memory forgetting. ","I received my MSc and Ph.D. in Chemical and Biological Sciences from the National School for Biological Sciences of the National Polytechnic Institute in Mexico City, Mexico. During my graduate work, I focused on the physiopathology and host immune response in free-living amoebae infections, using both in vivo and in vitro approaches. These studies included the characterization of proteases of Acanthamoeba spp and Naegleria spp as possible virulence mechanisms. In addition, we also studied the role of inflammation in the amoebic meningoencephalitis using CD38-/- knockout mice and the importance of mucins in the innate resistance to Naegleria infections.

Upon the completion of my Ph.D., I decided to move into the more challenging field of Neuroscience. I joined the Neuroscience Department at The Scripps Research Institute in 2009 to expand my technical skills and neuroscience knowledge. There, my research has focused on understanding how memories are encoded, consolidated, retrieved, and, most recently, how these are forgotten. For this, I use the fruit fly as an animal model. One of our significant findings is that normal forgetting is an active, well-regulated process that involves dopaminergic signals, which depend on the behavioral state of the animal. 

In 2019 I moved as an Assistant Professor at Georgetown University, where I will continue to develop a research program to understand how memories are encoded in the brain and how they are forgotten.
"
Ken Birman,Cornell,CS,Systems and Networking,Cloud Computing and the Intelligent Internet of Things.,"Cloud computing is a key element of the apps that run on mobile phones, big data analytics, and machine learning. In this talk, I’ll describe recent work to make the cloud friendlier for hosting sensors and actuators and for controlling smart power grids, smart homes, smart farms, smart highways and other demanding real-world applications. Some of these raise major questions about privacy, and those will be our focus in this short talk.","Ken Birman is the N. Rama Rao Professor of Computer Science at Cornell. An ACM Fellow and the winner of the IEEE Tsutomu Kanai Award, Ken has written 3 textbooks and published more than 150 papers in prestigious journals and conferences. Software he developed operated the New York Stock Exchange for more than a decade without trading disruptions, and plays central roles in the French Air Traffic Control System and the US Navy AEGIS warship. Other technologies from his group found their way into IBM’s Websphere product, Amazon’s EC2 and S3 systems, Microsoft’s cluster management solutions, and the US Northeast bulk power grid. His new Derecho and Cascade systems are intended for demanding settings such as the smart power grid, smart highways and homes, and scalable vision applications. Both can be downloaded from GitHub.com/Derecho-Project."
Corrine Yap,Rutgers,Math,Probabilistic Combinatorics,Crossing Disciplines: Probabilistic Combinatorics and Mathematical Theater,"Combinatorics is the study of discrete structures which can often be used to model real-world problems, from scheduling classes to finding efficient routes between cities to simulating social networks. A common question is: does a structure with certain nice properties exist? Surprisingly, probability and randomness can help us – even if the question has nothing random about it! I will introduce this so-called “Erdős Magic” method of proof. I will also discuss another example of how the integration of two different subjects can give surprising but invaluable results, namely my one-woman mathematical play, Uniform Convergence.","."
Dr. Teri Odom,Cornell,CS,Systems and Networking,Probabilistic Combinatorics,"Teri W. Odom is an expert in designing structured nanoscale materials that exhibit extraordinary size and shape-dependent optical properties. Odom has pioneered a suite of multi-scale nanofabrication tools that has resulted in flat optics that can manipulate light at the nanoscale and beat the diffraction limit, plasmon-based nanoscale lasers that exhibit tunable color, and hierarchical substrates that show controlled wetting and super-hydrophobicity. She has also invented a class of biological nanoconstructs that are facilitating unique insight into nanoparticle-cell interactions and that show superior imaging and therapeutic properties because of their gold nanostar shape.","Ken Birman is the N. Rama Rao Professor of Computer Science at Cornell. An ACM Fellow and the winner of the IEEE Tsutomu Kanai Award, Ken has written 3 textbooks and published more than 150 papers in prestigious journals and conferences. Software he developed operated the New York Stock Exchange for more than a decade without trading disruptions, and plays central roles in the French Air Traffic Control System and the US Navy AEGIS warship. Other technologies from his group found their way into IBM’s Websphere product, Amazon’s EC2 and S3 systems, Microsoft’s cluster management solutions, and the US Northeast bulk power grid. His new Derecho and Cascade systems are intended for demanding settings such as the smart power grid, smart highways and homes, and scalable vision applications. Both can be downloaded from GitHub.com/Derecho-Project."
Dr. Tom Hull, sdsdf, CS,Systems and Networking,Probabilistic Combinatorics,"Origami, the art of paper folding, has been practiced in Japan and all over the world for centuries. However, the past decade has witnessed a surge of interest in using origami for science. Applications in robotics, airbag design, deployment of space structures, and even medicine are appearing in the popular science press. Videos of origami robots folding themselves up and walking away or performing tasks have gone viral in recent years. What's more, the National Science Foundation has recently found origami valuable enough to fund millions of dollars for studying engineering and science applications of origami. But if the art of paper folding is so old, why has there been an increase in origami applications now? One answer is because of mathematics. Advances in our understanding of how folding processes work has arisen due to success in modeling origami mathematically. In this presentation we will explore why origami lends itself to mathematical study and see some of the applications that origami-math has inspired.","t."
Dr. James Tanton, sdsdf, CS,Systems and Networking,Probabilistic Combinatorics,"We humans have a predilection for the number 10 when it comes to matters of arithmetic and counting. (Why?) Computers are built to count in base two. (Why?) And if we ever build optic computers, they'd naturally work in base three. (Hmm!) But do we fully understand place-value? Let me share with you some curious thoughts on the matter and some unsolved questions.","t."
Nitu Kitchloo,John Hopkins University,Math,Algebra and Geometry,The close relationship between Algebra and Geometry,"I’ll motivate the close relationship between various distinct areas of Mathematics by offering an instance of how algebraic number systems (like the familiar ones: real numbers, complex numbers and the perhaps not so familiar ones: quaternions, octonians) bear a close relationship with certain ""higher dimensional"" geometric objects, and show how one dictates the behavior of the other.","Nitu Kitchloo is a professor in the Department of Mathematics at Johns Hopkins. In the early part of Professor Kitchloo's career, he was an assistant professor at Johns Hopkins before moving to the University of California, San Diego as an associate professor in 2004. In 2010, he returned to Johns Hopkins as a professor."
Olga Zhaxybayeva,Dartmouth,Biology,,"Genomic clues to origin, evolution and diversity of life","My research interests are to understand how microbes change over time. Recent advances in DNA sequencing technologies brought us an avalanche of data: thousands of genomes and terabases of environmental DNA (metagenomes). I mine these data sets to assess the impact of horizontal gene transfer on microbial populations, find new ways to characterize microbial communities, and track down genomic signatures of microbial adaptations.
",TD
Helen Vuong,UCLA,Biology,Integrative Bio & Phys,"Microbiome, Brain and Behaviors","Emerging evidence suggest the microbiome interacts with host physiology including immune, metabolic, and nervous system development and function. My research aims to uncover how microbes are critically important for brain development and development of neuro-related disease phenotypes.
I'll discuss how I started in neurobiology field and was later turned on to microbiome research.","Helen Vuong earned her B.S. in neuroscience from the University of California, Los Angeles (UCLA). She continued her graduate education at UCLA, earning her Ph.D. in molecular, cellular and integrative physiology under the mentorship of Dr. Nicholas C. Brecha. During her graduate studies, Vuong investigated the anatomical and electrophysiological regulation of retinal microcircuits by neuropeptides, including somatostatin and vasoactive intestinal polypeptide. She began her postdoctoral tenure in Dr. Elaine Y. Hsiao’s lab. In her postdoctoral research, Vuong aims to elucidate the role of the maternal microbiome in fetal brain development, including modulation of neuronal connectivity, activity and function. In particular, she will focus on specific bacteria species that affect serotonin synthesis and serotonin’s role in brain development. Vuong is also interested in understanding how changes in the maternal microbiome may affect offspring social and communicative behavior. Additionally, as an IRACDA fellow in UCLA’s UPLIFT program, she hopes to continue her research and pursue her passion in education and outreach, eventually developing and implementing an introductory gut—brain axis laboratory course.
"
Krishnendu Chakrabarty,Duke ,CS,Biochips,Computational Intelligence in the Design and Optimization of Digital Microfluidic Biochips,"Digital microfluidics was transitioned to the marketplace for sample preparation by Illumina a few years
ago. Since then, this technology has also been deployed by Genmark for infectious disease testing and
Baebies for the detection of lysosomal enzymes in newborns. This lecture will describe the journey from
early laboratory research, PhD theses and publication of research articles, to technology transfer and
licensing to companies. Today’s microfluidic biochips are fully automated under program control and
they can be dynamically reconfigured using sensor data. The speaker will describe how computational
intelligence has enabled the design and optimization of such reconfigurable biochips.","Krishnendu Chakrabarty is the John Cocke Distinguished Professor and Department Chair of Electrical
and Computer Engineering (ECE), and Professor of Computer Science, at Duke University. He has held
Visiting Professor positions and Chair Professorships at University of Tokyo (Japan), University of
Bremen (Germany), Tsinghua University (China), National Tsinghua University (Taiwan) and National
Cheng-Kung University (Taiwan).
Prof. Chakrabarty is a recipient of the National Science Foundation CAREER award, the Office of Naval
Research Young Investigator award, the Humboldt Research Award from the Alexander von Humboldt
Foundation, Germany, the IEEE Computer Society Technical Achievement Award (2015), the IEEE
Circuits and Systems Society Charles A. Desoer Technical Achievement Award (2017), the
Semiconductor Research Corporation Technical Excellence Award (2018), and the Japan Society for the
Promotion of Science (JSPS) Invitational Fellowship in the “Short Term S: Nobel Prize Level” category
(2018).
Prof. Chakrabarty’s current research projects include: design-for-testability of integrated circuits and
systems (especially 3D integration and system-on-chip); microfluidic biochips; hardware security;
machine learning for eHealth; neuromorphic computing systems. He is a Fellow of ACM, IEEE, AAAS,
and a Golden Core Member of the IEEE Computer Society."
Daniel Holz,UChicago,Physics,"Astronomy, Astrophysics",Listening to the Universe,"I spend my time thinking about colliding black holes in distant galaxies at the edge of the Universe. I will give an overview of some of my research, and also discuss the path I took to becoming a professor. ","Daniel Holz is a professor at the University of Chicago in the Departments of Physics, Astronomy & Astrophysics, the Enrico Fermi Institute, and the Kavli Institute for Cosmological Physics. His research focuses on black holes and cosmology. He is a member of the Laser Interferometer Gravitational-Wave Observatory (LIGO) collaboration, and was part of the team that announced the discovery of gravitational waves from black holes in early 2016 and the detection of colliding neutron stars in 2017."
Jens Koch,,,,emailed again,,
Michael Schmitt,,,,emailed again,,
Christine Aidala,UMichigan,,,Peering Into the Proton,"Protons are at the core of every atom, forming the atomic nucleus along with their uncharged partners, neutrons.  As tiny as they are, we know that protons are composed of yet tinier subcomponents, known as quarks and gluons.  Dr. Aidala will discuss what we have learned so far about how quarks and gluons lead to the rich and complex internal workings of this basic building block of everyday matter.  
",
Marcelo Gleiser,,,,,"Marcelo Gleiser is the Appleton Professor of Natural
Philosophy and a professor of physics and astronomy at
Dartmouth College. He obtained his Ph.D. from King's
College London and received the 1994 Presidential Faculty
Fellows Award from the White House. He is a Fellow and
past General Councilor of the American Physical Society. He
is the 2019 Templeton Prize Laureate, an honor he shares
with Mother Tereza, Archbishop Desmond Tutu, the Dalai
Lama, and scientists Freeman Dyson and Martin Rees. Also
in 2019, he won the Education Leadership Award from
Educando by Worldfund Foundation.
His books have been published in 15 languages and include
The Island of Knowledge: The Limits of Science and The
Search for Meaning, A Tear at the Edge of Creation, and
The Simple Beauty of the Unexpected. A leading public
intellectual and world-renowned theoretical physicist
interested in cosmology and astrobiology, he has published
hundreds of peer-reviewed articles, and more than a
thousand essays and op-eds, and frequently participates in
TV documentaries and radio shows in the US and abroad.
He is the co-founder of the NPR blog on science and
culture,13.7. He currently directs the Institute for Cross-
Disciplinary Engagement at Dartmouth College.
More details at http://www.marcelogleiser.com","Marcelo Gleiser is the Appleton Professor of Natural
Philosophy and a professor of physics and astronomy at
Dartmouth College. He obtained his Ph.D. from King&#39;s
College London and received the 1994 Presidential Faculty
Fellows Award from the White House. He is a Fellow and
past General Councilor of the American Physical Society. He
is the 2019 Templeton Prize Laureate, an honor he shares
with Mother Tereza, Archbishop Desmond Tutu, the Dalai
Lama, and scientists Freeman Dyson and Martin Rees. Also
in 2019, he won the Education Leadership Award from
Educando by Worldfund Foundation.
His books have been published in 15 languages and include
The Island of Knowledge: The Limits of Science and The
Search for Meaning, A Tear at the Edge of Creation, and
The Simple Beauty of the Unexpected. A leading public
intellectual and world-renowned theoretical physicist
interested in cosmology and astrobiology, he has published
hundreds of peer-reviewed articles, and more than a
thousand essays and op-eds, and frequently participates in
TV documentaries and radio shows in the US and abroad.
He is the co-founder of the NPR blog on science and
culture,13.7. He currently directs the Institute for Cross-
Disciplinary Engagement at Dartmouth College.
More details at http://www.marcelogleiser.com"
Dr. Jane Frommer,CalTech (not a professor though),Chem,Nanotech,"the molecular underpinnings of nanotechnology
","Creating objects on the nanometer scale - the scale of single molecules - requires unambiguous tracking of features produced (steps performed) at each stage along the preparative pathway.  Complicating this tracking is the tendency for materials to display properties that are different on this very small scale than on larger and visible scales, a non-scaling behavior that is both intriguing and challenging.   

The evolution of instrumentation that is capable of reliably monitoring material behavior has been essential to ushering in the nanotech age.  Furthermore, the design of instruments that accurately analyze materials has been cleverly redirected toward manipulating and constructing landscapes on the nanometer scale, leading to the rapid growth in R&D of nanomanufacturing.  In this talk, the origin and evolution of molecular identification and manipulation will be traced through current day applications of nanotechnology. ","Dr. Jane Frommer received the 2020 Perkin Medal for bringing chemical awareness to
pioneering research areas in physics and engineering. She has authored over 100
articles and is co-inventor on over 50 issued patents in the fields of electronically
conducting polymers and scanning probes based on tunneling and atomic force.
The analytical methods she developed are critical in the growth of nanotechnology, vital
in the feedback loop of creating nanostructures. Dr. Frommer’s research labs bridged
the gap between academia and industry. Through fundamental research she fostered
generations of students and upheld international presence as a scientist, collaborator,
and mentor. Dr. Frommer’s research environments have included bio-organic undergraduate
research at MIT, Vitamin D research at the Mass General Hospital, organometallic
synthesis at Caltech, electronically conducting polymers at Honeywell (Allied), and
atomic force measurements in material science at IBM Research. Her chemistry
degrees are from Tufts University (BS) and Caltech (PhD)."
